Show Date	Artist	Supporting Acts	Venue	Setlist.fm URL	Playlist URL	Match Type	YT Title	Notes / Memories
2023-11-25	Liz Phair	Blondshell	The Anthem, Washington, DC, USA	https://www.setlist.fm/setlist/liz-phair/2023/the-anthem-washington-dc-13a14d89.html	https://www.youtube.com/playlist?list=PLJ7S-K0cjvGK7QBK-sXIc5g_ZJnCJecir	Playlist (10 videos)	Liz Phair LIVE @ The Anthem (DC) 11/25/23	"Guyville Tour, upper balcony at The Anthem. Also shot Blondshell opening set — favorite lyric from their set: ""it was nice what you said, but it doesn't carry weight."""
2023-11-26	The Lone Bellow	Stephen Wilson Jr	Wolf Trap Farm Park (The Barns), Vienna, VA, USA	https://www.setlist.fm/setlist/the-lone-bellow/2023/wolf-trap-farm-park-the-barns-vienna-va-53aea3e5.html	https://www.youtube.com/playlist?list=PLJ7S-K0cjvGKRyNDy8v0VqJXIn3HkT39K	Playlist (10 videos)	The Lone Bellow LIVE - Marshmallow World (bootleg) | The Lone Bellow LIVE - Q+A band history (no song) | The Lone Bellow LIVE - Watch Over Us (acoustic trio bootleg) | The Lone Bellow LIVE - Just Enough to Love You (bootleg) | The Lone Bellow LIVE - Marietta (bootleg) | The Lone Bellow LIVE - Time's Always Leaving (bootleg) | The Lone Bellow LIVE - Then Came the Morning (bootleg) | The Lone Bellow LIVE - Fake Roses (bootleg) | The Lone Bellow LIVE - Keep it Together (bootleg) | The Lone Bellow LIVE - Dried Up River (bootleg)	VIP pre-show meet & greet at The Barns — unamplified, no mics. They did a Dean Martin cover (Marshmallow World) and answered fan Q&A. Shot from in front of Kanene for the main set. Hat autograph: Kanene Pipkin (of The Lone Bellow).
2023-12-03	Samantha Fish & Jesse Dayton	Jon Spencer / Eric Johanson	The Fillmore Silver Spring, Silver Spring, MD, USA	https://www.setlist.fm/setlist/samantha-fish-and-jesse-dayton/2023/the-fillmore-silver-spring-silver-spring-md-33aef4dd.html	https://www.youtube.com/playlist?list=PLJ7S-K0cjvGJm7BrRMqolPm0GAU4mLIdg	9 video(s) found	Samantha Fish LIVE - I'll Be Here in the Morning (bootleg) | Samantha Fish LIVE - Kick out the Jams (bootleg) | Samantha Fish LIVE - Bulletproof (bootleg) | Samantha Fish LIVE - Blood in the Water (bootleg) | Samantha Fish LIVE - Slow Burn (bootleg) | Samantha Fish LIVE - Death Wish Blues (bootleg) | Samantha Fish and Jesse Dayton LIVE - Cigar Box Guitar Duet (bootleg) | Samantha Fish LIVE - Death Wish Blues (acoustic, bootleg) | Samantha Fish LIVE - Faster (bootleg)	Death Wish Blues tour. Set opened with MC5 cover (Kick Out the Jams). Also shot Townes Van Zandt cover (I'll Be Here in the Morning) and cigar box guitar duet. Jon Spencer and Eric Johanson also on the bill. Hat autograph: Samantha Fish.
2023-12-04	Tab Benoit		The Birchmere, Alexandria, VA, USA	https://www.setlist.fm/setlist/tab-benoit/2023/the-birchmere-alexandria-va-3baee48c.html	https://www.youtube.com/playlist?list=PLJ7S-K0cjvGLoWqqwTUY1njk0tT8qlJ-j	Playlist (5 videos)	Tab Benoit LIVE @ Birchmere 12/4/23	Screamin' Jay Hawkins cover (I Put a Spell on You). Also caught the Dirty Dozen Brass Band on the bill.
2023-12-05	The Allman Betts Band		Capital One Hall, Tysons Corner, VA, USA	https://www.setlist.fm/setlist/the-allman-betts-band/2023/capital-one-hall-tysons-corner-va-13aed909.html	https://www.youtube.com/playlist?list=PLJ7S-K0cjvGKHr_xJc757cjDVZFPzcd3w	Playlist (6 videos)	Allman Betts Band LIVE @ Capital One Hall 12/5/23	All-star night: featured guests included Tal Wilkenfeld, Jimmy Hall, Ally Venable, and Ghalia Volt. 3rd row stage left, lots of heads and arms in the way.
2023-12-10	Allison Russell		The Birchmere, Alexandria, VA, USA	https://www.setlist.fm/setlist/allison-russell/2023/the-birchmere-alexandria-va-2bae08ca.html	https://www.youtube.com/playlist?list=PLJ7S-K0cjvGKiu9D23lUv6bKPDFn4yeF0	Playlist (assembled)	Allison Russell LIVE - Stay Right Here (bootleg) | Allison Russell LIVE - Eve Was Black (bootleg) | Allison Russell LIVE - Demons (bootleg)	Hat autograph: Allison Russell.
2023-12-15	Sadurn	Brassie / Glom	The Atlantis, Washington, DC, USA	https://www.setlist.fm/setlist/sadurn/2023/the-atlantis-washington-dc-5baf9b48.html	https://www.youtube.com/playlist?list=PLJ7S-K0cjvGL_NJe6hrWQkT33KqZJ_XnO	Playlist (8 videos)	Sadurn LIVE with Brassie & Glom @ The Atlantis DC 12/15/23	"First visit to The Atlantis. ""Deep Dive Live"" triple bill (Brassie, Glom, Sadurn). Very singalong neighbor for Sadurn."
